"DESCRIPTION","DURATION IN MS","NAME","PARENT SUITE","START TIME","STATUS","STOP TIME","SUB SUITE","SUITE","TEST CLASS","TEST METHOD"
"","28934","test_systemd_restarts_pgbouncer_processes","tests.integration","2025-09-06","passed","2025-09-06","","test_charm","",""
"Test that we can exit relations with multiple units without breaking anything.","","test_exit_relations","tests.integration.relations","","unknown","","","test_peers","",""
"","30394","test_restart_unit","tests.integration","2025-09-06","passed","2025-09-06","","test_charm","",""
"Test that the pgbouncer and postgres charms can relate to one another.","","test_relate_pgbouncer_to_postgres","tests.integration.relations","","unknown","","","test_backend_database","",""
"Check we can update and delete things.","1025","test_database_usage","tests.integration.relations.pgbouncer_provider","2025-09-06","passed","2025-09-06","","test_pgbouncer_provider","",""
"Deploy Landscape Scalable Bundle to test the 'db-admin' relation.","3351240","test_landscape_scalable_bundle_db","tests.integration.relations","2025-09-06","broken","2025-09-06","","test_db_admin","",""
"Test that the pre-upgrade-check action runs successfully.","3486","test_pre_upgrade_check","tests.integration","2025-09-06","passed","2025-09-06","","test_upgrade_data_integrator","",""
"Change config and assert that the pgbouncer config file looks how we expect.","32950","test_change_config","tests.integration.relations.pgbouncer_provider","2025-09-06","passed","2025-09-06","","test_data_integrator","",""
"Test basic functionality of database relation interface.","1077361","test_deploy_and_relate","tests.integration.relations.pgbouncer_provider","2025-09-06","passed","2025-09-06","","test_data_integrator_ha","",""
"Simple test to ensure that the PostgreSQL and application charms get deployed.","689454","test_deploy_stable","tests.integration","2025-09-06","passed","2025-09-06","","test_upgrade_data_integrator","",""
"","69197","test_scale_down","tests.integration","2025-09-06","passed","2025-09-06","","test_subordinates","",""
"Test that an application can request additional databases using the same interface.

    This occurs using a new relation per interface (for now).
    ","194766","test_an_application_can_request_multiple_databases","tests.integration.relations.pgbouncer_provider","2025-09-06","passed","2025-09-06","","test_pgbouncer_provider","",""
"Check that an invalid database name makes the database charm block.","","test_database","tests.integration.relations.pgbouncer_provider","","unknown","","","test_invalid_database","",""
"Test that the pre-upgrade-check action runs successfully.","","test_pre_upgrade_check","tests.integration","","unknown","","","test_upgrade_from_stable","",""
"","265171","test_scale_up","tests.integration","2025-09-06","passed","2025-09-06","","test_subordinates","",""
"Test data is replicated to new units after a scale up.","","test_scaling","tests.integration.relations","","unknown","","","test_peers","",""
"Test that two different application connect to the database with different credentials.","18486","test_two_applications_cant_relate_to_the_same_pgb","tests.integration.relations.pgbouncer_provider","2025-09-06","passed","2025-09-06","","test_pgbouncer_provider","",""
"","","test_tls_encrypted_connection_to_postgres","tests.integration.relations","","unknown","","","test_backend_database","",""
"","16652","test_systemd_restarts_exporter_process","tests.integration","2025-09-06","passed","2025-09-06","","test_charm","",""
"Check that invalid extra user roles make the PgBouncer charm block.","","test_extra_user_roles","tests.integration.relations.pgbouncer_provider","","unknown","","","test_invalid_extra_user_roles","",""
"Check that the data integrator user can perform the expected operations in each database.","","test_operations","tests.integration.relations.pgbouncer_provider","","unknown","","","test_predefined_roles","",""
"Test updating from stable channel.","","test_upgrade_from_stable","tests.integration","","unknown","","","test_upgrade_from_stable","",""
"","","test_deploy_at_scale","tests.integration.relations","","unknown","","","test_peers","",""
"Test that there is no read-only endpoint in a standalone cluster.","18659","test_localhost_read_only_endpoint_in_standalone_cluster","tests.integration.relations.pgbouncer_provider","2025-09-06","passed","2025-09-06","","test_pgbouncer_provider","",""
"","74759","test_upgrade_from_edge","tests.integration","2025-09-06","passed","2025-09-06","","test_upgrade","",""
"Test basic functionality of database relation interface.","663783","test_database_relation_with_charm_libraries","tests.integration.relations.pgbouncer_provider","2025-09-06","passed","2025-09-06","","test_pgbouncer_provider","",""
"Deploy the charms.","","test_deploy","tests.integration.relations.pgbouncer_provider","","unknown","","","test_invalid_extra_user_roles","",""
"Test that an application can connect to different clusters of the same database.","730209","test_an_application_can_connect_to_multiple_database_clusters","tests.integration.relations.pgbouncer_provider","2025-09-06","passed","2025-09-06","","test_pgbouncer_provider","",""
"Deploy Mailman3 Core to test the 'db' relation.","938760","test_mailman3_core_db","tests.integration.relations","2025-09-06","passed","2025-09-06","","test_db","",""
"Change config and assert that the pgbouncer config file looks how we expect.","20822","test_change_config","tests.integration","2025-09-06","passed","2025-09-06","","test_charm","",""
"","79084","test_fail_and_rollback","tests.integration","2025-09-06","passed","2025-09-06","","test_upgrade","",""
"Test that there is read-only endpoint in a scaled up cluster.","168669","test_localhost_read_only_endpoint_in_scaled_up_cluster","tests.integration.relations.pgbouncer_provider","2025-09-06","passed","2025-09-06","","test_pgbouncer_provider","",""
"Test that the pgbouncer, postgres, and client charms can relate to one another.","","test_scaled_relations","tests.integration.relations","","unknown","","","test_peers","",""
"Test that PGB blocks on disabled extension request and allows enabled ones.","361269","test_extensions","tests.integration.relations","2025-09-06","passed","2025-09-06","","test_db","",""
"","29141","test_add_tls","tests.integration.relations.pgbouncer_provider","2025-09-06","passed","2025-09-06","","test_data_integrator","",""
"Test that the pre-upgrade-check action runs successfully.","4437","test_pre_upgrade_check","tests.integration","2025-09-06","passed","2025-09-06","","test_upgrade","",""
"Test basic functionality of database relation interface.","573655","test_deploy_and_relate","tests.integration.relations.pgbouncer_provider","2025-09-06","passed","2025-09-06","","test_data_integrator","",""
"Simple test to ensure that the PostgreSQL and application charms get deployed.","","test_deploy_stable","tests.integration","","unknown","","","test_upgrade_from_stable","",""
"","108410","test_remove_relation","tests.integration.relations","2025-09-06","passed","2025-09-06","","test_db","",""
"Check these relations all work when scaling pgbouncer.","323629","test_scaling","tests.integration.relations.pgbouncer_provider","2025-09-06","passed","2025-09-06","","test_pgbouncer_provider","",""
"Build and deploy one unit of PostgreSQL and then test config with wrong parameters.","331916","test_config_parameters","tests.integration","2025-09-06","passed","2025-09-06","","test_config","",""
"Deploy the charms.","","test_deploy","tests.integration.relations.pgbouncer_provider","","unknown","","","test_invalid_database","",""
"","290557","test_remove_vip","tests.integration.relations.pgbouncer_provider","2025-09-06","passed","2025-09-06","","test_data_integrator_ha","",""
"Test updating from stable channel.","96258","test_upgrade_from_stable","tests.integration","2025-09-06","passed","2025-09-06","","test_upgrade_data_integrator","",""
"Check version is accurate.","1177","test_database_version","tests.integration.relations.pgbouncer_provider","2025-09-06","passed","2025-09-06","","test_pgbouncer_provider","",""
"","33385","test_add_tls","tests.integration.relations.pgbouncer_provider","2025-09-06","passed","2025-09-06","","test_data_integrator_ha","",""
"","885708","test_deploy","tests.integration","2025-09-06","passed","2025-09-06","","test_subordinates","",""
"","25461","test_remove_tls","tests.integration.relations.pgbouncer_provider","2025-09-06","passed","2025-09-06","","test_data_integrator_ha","",""
"Build and deploy the charm-under-test.

    Assert on the unit status before any relations/configurations take place.
    ","350145","test_build_and_deploy","tests.integration","2025-09-06","passed","2025-09-06","","test_charm","",""
"","36687","test_remove_tls","tests.integration.relations.pgbouncer_provider","2025-09-06","passed","2025-09-06","","test_data_integrator","",""
"Simple test to ensure that the PostgreSQL and application charms get deployed.","828856","test_deploy_latest","tests.integration","2025-09-06","passed","2025-09-06","","test_upgrade","",""
"Test that the user is removed when the relation is broken.","0","test_relation_broken","tests.integration.relations.pgbouncer_provider","2025-09-06","skipped","2025-09-06","","test_pgbouncer_provider","",""
"Deploy and relate the charms.","","test_deploy","tests.integration.relations.pgbouncer_provider","","unknown","","","test_predefined_roles","",""
"Test admin permissions.","2035","test_database_admin_permissions","tests.integration.relations.pgbouncer_provider","2025-09-06","passed","2025-09-06","","test_pgbouncer_provider","",""
"Verify that logs will be rotated.","896","test_logrotate","tests.integration","2025-09-06","passed","2025-09-06","","test_charm","",""
